{
  "aad_engine": "disabled",
  "coupon_fixings": [
    21.0,
    23.0,
    19.0,
    23.0,
    19.0
  ],
  "coupon_pv": 0.1859171198608385,
  "daily_observations": 106,
  "engine": "cpp_daily_termsheet_eki",
  "funding": 0.9845438153506495,
  "ki_monitoring": "EKI",
  "ki_probability": 0.1171875,
  "ko_probability": 0.3984375,
  "memory_carry": [
    0.0,
    0.0,
    0.515625,
    0.0,
    0.0
  ],
  "paths": 128,
  "put_price": 0.01973180295899707,
  "pv": 1.1507291322524908,
  "relative_delta": [
    -0.25799989535825185,
    -0.7498998122629996
  ],
  "relative_gamma": [
    -3.1506020429250547,
    4.823631245354232
  ],
  "underlyings": 2,
  "relative_vega": [
    -0.17521826541231356,
    -0.10066703494245877
  ]
}
